{
  "raw_idea": "Pharmacy POS for inventory and billing",
  "status": "DISCOVERY_COMPLETE",
  "completeness_score": 0.99,
  "intent": {
    "primary_goal": "Pharmacy POS for inventory and billing",
    "problem_statement": "Managing pharmacy inventory, sales, and prescription handling efficiently.",
    "domain": "healthcare/pharmacy"
  },
  "users": [
    {
      "persona": "Pharmacist",
      "needs": "Dispensary and stock oversight",
      "confirmed": true
    },
    {
      "persona": "Cashier",
      "needs": "Point of sale billing",
      "confirmed": true
    }
  ],
  "problems": [],
  "desired_outcomes": [],
  "features": [
    {
      "name": "Inventory Management",
      "description": "Track stock levels, reorder points, and item batches",
      "priority": "must",
      "confirmed": true
    },
    {
      "name": "Billing & POS",
      "description": "Process sales transactions, taxes, and receipt generation",
      "priority": "must",
      "confirmed": true
    },
    {
      "name": "Prescription Tracking",
      "description": "Record doctor prescriptions and patient dispensation history",
      "priority": "must",
      "confirmed": true
    }
  ],
  "constraints": [
    {
      "type": "connectivity",
      "description": "Offline-first billing with local SQLite cache",
      "confirmed": true
    },
    {
      "type": "architecture",
      "description": "Single store architecture (no multi-branch complexity)",
      "confirmed": true
    }
  ],
  "preferences": {
    "platform": [
      "Mobile"
    ],
    "tech_stack": [],
    "ui_style": "standard"
  },
  "assumptions": [
    {
      "id": "ASSUMPTION-001",
      "assumption": "Application requires secure transaction recording and audit logs",
      "evidence_basis": "Inferred from POS / financial domain requirements",
      "confidence": 0.85,
      "impact_if_invalid": "high",
      "validation_status": "pending"
    }
  ],
  "unknowns": [
    {
      "id": "UNK-USER",
      "category": "intent",
      "question": "Who are the primary people using this application (e.g. pharmacists, cashiers, store owners, or general consumers)?",
      "impact": "critical",
      "uncertainty": 1,
      "dependency": 3,
      "risk": 4,
      "resolved": true,
      "answer": "Single pharmacy location, offline billing needed, for pharmacists and cashiers, mobile Android"
    },
    {
      "id": "UNK-OFFLINE",
      "category": "architecture",
      "question": "Does billing need to function offline without an active internet connection?",
      "impact": "high",
      "uncertainty": 0.8,
      "dependency": 3,
      "risk": 3,
      "resolved": true,
      "answer": "Offline billing required"
    },
    {
      "id": "UNK-PRESCRIPTION",
      "category": "scope",
      "question": "Should the MVP support prescription tracking and doctor details, or only general retail products?",
      "impact": "high",
      "uncertainty": 0.9,
      "dependency": 2,
      "risk": 3,
      "resolved": true,
      "answer": "Prescription tracking enabled"
    },
    {
      "id": "UNK-BRANCH",
      "category": "scope",
      "question": "Is this for a single store/pharmacy location or multiple branches with centralized reporting?",
      "impact": "high",
      "uncertainty": 0.85,
      "dependency": 2,
      "risk": 3,
      "resolved": true,
      "answer": "Single pharmacy location"
    },
    {
      "id": "UNK-PLATFORM",
      "category": "ux",
      "question": "What platform will users access this on (Web browser, Mobile Android/iOS, or Desktop application)?",
      "impact": "medium",
      "uncertainty": 0.7,
      "dependency": 2,
      "risk": 2,
      "resolved": true,
      "answer": "Mobile Android"
    }
  ],
  "decisions": [],
  "risks": [],
  "contradictions": [],
  "created_at": "2026-09-19T19:52:32.839Z",
  "updated_at": "2026-09-19T19:52:41.914Z"
}